datasetId,traitNameVerbatim
amp,scaled functional response for McKe1987 food regime 3
amp,scaled functional response for McKe1987 food regime 4
amp,scaled functional response for Medjimurje data
amp,scaled functional response for MillElor1985
amp,scaled functional response for MuseBorg2002
amp,scaled functional response for naturally hatched
amp,scaled functional response for Nesto fed ad libitum with 28 percent protein
amp,scaled functional response for Nesto fed ad libitum with 66 percent protein
amp,scaled functional response for Nesto fed ad libitum with 9.5
amp,scaled functional response for NewsBeak
amp,scaled functional response for NF221 data
amp,scaled functional response for NF222 data
amp,scaled functional response for Ningaloo juvenile and adult data
amp,scaled functional response for NK430 data
amp,scaled functional response for NK91 data
amp,scaled functional response for OB  data
amp,scaled functional response for oct data
amp,scaled functional response for oligotrophic lake in Finland
amp,scaled functional response for OrsiJaen1996 data
amp,scaled functional response for Otocac
amp,scaled functional response for OtteNyha1999 data
amp,scaled functional response for PA exp data
amp,scaled functional response for ParrBala2017
amp,scaled functional response for ParrDyar1978
amp,scaled functional response for ParrYufe2001 data
amp,scaled functional response for PaynPoli2010 data
amp,scaled functional response for pups
amp,scaled functional response for respiration data
amp,scaled functional response for respiro data
amp,scaled functional response for RibeEngr2017 data
amp,scaled functional response for RiceHick1989 data
amp,scaled functional response for Rico-data
amp,scaled functional response for RigwRich2011 data
amp,scaled functional response for ScarStee2017
amp,scaled functional response for SchoSchw2000
amp,scaled functional response for SeitVilp2005 data
amp,scaled functional response for Shabica
amp,scaled functional response for ShelClar1995 data
amp,scaled functional response for SO  data
amp,scaled functional response for Soho
amp,scaled functional response for south coast
amp,scaled functional response for S. Pouvreau in situ data
amp,scaled functional response for Swee2018 data
amp,scaled functional response for Ta data
amp,scaled functional response for tadpole data
amp,scaled functional response for tadpole data set 1
amp,scaled functional response for tadpole data set 2
amp,scaled functional response for tadpole data set 3
amp,scaled functional response for tadpole data set 4
amp,scaled functional response for tadpole data set 5
amp,scaled functional response for tadpole data set 6
amp,scaled functional response for Tae data
amp,scaled functional response for Tah
amp,scaled functional response for Tah data
amp,scaled functional response for TAN data
amp,scaled functional response for Tap data
amp,scaled functional response for tdL data
amp,scaled functional response for tdW data
amp,scaled functional response for tE data at 00 d
amp,scaled functional response for tE data at 05 d
amp,scaled functional response for tE data at 10 d
amp,scaled functional response for temperature experiment
amp,scaled functional response for tfW10 data
amp,scaled functional response for tfW120 data
amp,scaled functional response for tfW1 data
amp,scaled functional response for tfW20 data
amp,scaled functional response for tfW40 data
amp,scaled functional response for tfW5 data
amp,scaled functional response for tfW80 data
amp,scaled functional response for time - length data of GhezCamb2012
amp,scaled functional response for time length data Sand1981
amp,scaled functional response for time - weight data of control female NO 41
amp,scaled functional response for time - weight data of control female NO 44
amp,scaled functional response for time - weight data of control female NO 46
amp,scaled functional response for time - weight data of control female NO 47
amp,scaled functional response for time - weight data of control female NO 49
amp,scaled functional response for time - weight data of control female NO 50
amp,scaled functional response for time - weight data of control females
amp,scaled functional response for time - weight data of RoeLee1995 females
amp,scaled functional response for TJO1 data
amp,scaled functional response for TJO2 data
amp,scaled functional response for tJO data
amp,scaled functional response for TJO data
amp,scaled functional response for tL
amp,scaled functional response for tL0 and tW0 data
amp,scaled functional response for tL_0 data
amp,scaled functional response for tL0 data
amp,scaled functional response for tL1
amp,scaled functional response for tL_100 data
amp,scaled functional response for tL_1200 data
amp,scaled functional response for tL_1425 data
amp,scaled functional response for tL_15 data
amp,scaled functional response for tL_16
amp,scaled functional response for tL_16 data
amp,scaled functional response for tL17 data
amp,scaled functional response for tL_1973 data
amp,scaled functional response for tL_1974 data
amp,scaled functional response for tL_1995 data
amp,scaled functional response for tL1 and tN data
amp,scaled functional response for tL1 and tW1 data
amp,scaled functional response for tL1 and tWl data
amp,scaled functional response for tL1 and tWw1 data
amp,scaled functional response for tL_1 data
amp,scaled functional response for tL1 data
amp,scaled functional response for tL2
amp,scaled functional response for tL_20
amp,scaled functional response for tL2000 data
amp,scaled functional response for tL2001 data
amp,scaled functional response for tL2002 data
amp,scaled functional response for tL201* data at 000 d
amp,scaled functional response for tL201* data at 100 d
amp,scaled functional response for tL201* data at 200 d
amp,scaled functional response for tL201* data at 300 d
amp,scaled functional response for tL_20 data
amp,scaled functional response for tL20 data
amp,scaled functional response for tL_22
amp,scaled functional response for tL_24 data
amp,scaled functional response for tL24 data
amp,scaled functional response for tL_25
amp,scaled functional response for tL_25 data
amp,scaled functional response for tL25 data
amp,scaled functional response for tL_28 data
amp,scaled functional response for tL_2 and tL_3 data
amp,scaled functional response for tL2 and tW2 data
amp,scaled functional response for tL_2 data
amp,scaled functional response for tL2 data
amp,scaled functional response for tL3
amp,scaled functional response for tL30 data
amp,scaled functional response for tL35 data
amp,scaled functional response for tL3 and tL5 data
amp,scaled functional response for tL_3 data
amp,scaled functional response for tL3 data
amp,scaled functional response for tL4
amp,scaled functional response for tL4 and tW4 data
amp,scaled functional response for tL-4 data
amp,scaled functional response for tL_4 data
amp,scaled functional response for tL4 data
amp,scaled functional response for tL5
amp,scaled functional response for tL_50 data
amp,scaled functional response for tL_5 data
amp,scaled functional response for tL5 data
amp,scaled functional response for tL6
amp,scaled functional response for tL_6 data
amp,scaled functional response for tL7
amp,scaled functional response for tL_7 data
amp,scaled functional response for tL81 data
amp,scaled functional response for tL82 data
amp,scaled functional response for tL_92 data
amp,scaled functional response for tL_93 data
amp,scaled functional response for tL_94 data
amp,scaled functional response for tL_A
amp,scaled functional response for tL_A and tWw_A data
amp,scaled functional response for tL_a data
amp,scaled functional response for tL_A data
amp,scaled functional response for tLA data
amp,scaled functional response for tL_adult1 data
amp,scaled functional response for tL_AL data
amp,scaled functional response for tL and LN data
amp,scaled functional response for tL and LW  data
amp,scaled functional response for tL and LWw data
amp,scaled functional response for t-L and t-W data
amp,scaled functional response for tL and tW data
amp,scaled functional response for tL and tWdata
amp,scaled functional response for tL and tW data at Trevor
amp,scaled functional response for tL and tWw and LWw data
amp,scaled functional response for tL and tWw data
amp,scaled functional response for tL and tWw data for d 000
amp,scaled functional response for tL and tWw data for d 090
amp,scaled functional response for tL and tWw data for d 150
amp,scaled functional response for tL and tWw data for d 175
amp,scaled functional response for tL_Anyui
amp,scaled functional response for tL_AR data
amp,scaled functional response for tL_B
amp,scaled functional response for tL_BB data
amp,scaled functional response for tL_BC data
amp,scaled functional response for tLb data
amp,scaled functional response for tL_B data
amp,scaled functional response for tL_B data at t=000 d
amp,scaled functional response for tL_B data at t=060 d
amp,scaled functional response for tL_B data at t=120 d
amp,scaled functional response for tL_B data at t=140 d
amp,scaled functional response for tL_B data at t=220 d
amp,scaled functional response for tL_B data at t=240 d
amp,scaled functional response for tL_B data at t=300 d
amp,scaled functional response for tL_BohlJoos1982 data
amp,scaled functional response for tL_Bormida data
amp,scaled functional response for tL_Bosque data
amp,scaled functional response for tL_Bri data
amp,scaled functional response for tLC1 data
amp,scaled functional response for tLC2 data
amp,scaled functional response for tLC3 data
amp,scaled functional response for tLC4 data
amp,scaled functional response for tL_c data
amp,scaled functional response for tL_C data
amp,scaled functional response for tLC data
amp,scaled functional response for tL_Cha data
amp,scaled functional response for tL_Ch data
amp,scaled functional response for tL_CI data
amp,scaled functional response for tL_Co data
amp,scaled functional response for tL_CS data
amp,scaled functional response for t-L data
amp,scaled functional response for tL  data
amp,scaled functional response for tL data
amp,scaled functional response for tL-data
amp,scaled functional response fortL data
amp,scaled functional response for tL data > 365 d
amp,scaled functional response for tL data at 0000 d
amp,scaled functional response for tL data at 000 d
amp,scaled functional response for tL data at 00 d
amp,scaled functional response for tL data at 090 d
amp,scaled functional response for tL data at 0 d
amp,scaled functional response for tL data at 1000 d
amp,scaled functional response for tL data at 100 d
amp,scaled functional response for tL data at 10 d
amp,scaled functional response for tL data at 10 m deep in Newfoundland
amp,scaled functional response for tL data at 1500 d
amp,scaled functional response for tL data at 2000 d
amp,scaled functional response for tL data at 200 d
amp,scaled functional response for tL data at 20 d
amp,scaled functional response for tL data at 25e3 d
amp,scaled functional response for tL data at 2600 d
amp,scaled functional response for tL data at 300 d
amp,scaled functional response for tL data at 30 d
amp,scaled functional response for tL data at 31 m deep in Newfoundland
amp,scaled functional response for tL data at 400 d
amp,scaled functional response for tL data at 40 d
amp,scaled functional response for tL data at 500 d
amp,scaled functional response for tL data at 600 d
amp,scaled functional response for tL data at 700 d
amp,scaled functional response for tL data at 8000 d
amp,scaled functional response for tL data at 800 d
amp,scaled functional response for tL data at 999 d
amp,scaled functional response for tL data at Craig-yr-Wylfa
amp,scaled functional response for tL data at site 1
amp,scaled functional response for tL data at site 2
amp,scaled functional response for tL  data at t=0
amp,scaled functional response for tL  data at t=1000
amp,scaled functional response for tL data at t = 1050 d
amp,scaled functional response for tL data at t = 1200 d
amp,scaled functional response for tL data at t = 150 d
amp,scaled functional response for tL data  at t=2000 d
amp,scaled functional response for tL data at t = 300 d
amp,scaled functional response for tL data at t = 450 d
amp,scaled functional response for tL data at t=5000 d
amp,scaled functional response for tL data at t = 600 d
amp,scaled functional response for tL data at t = 750 d
amp,scaled functional response for tL data at t = 900 d
amp,scaled functional response for tL data for >4000 d
amp,scaled functional response for tL data (gaia2016)
amp,scaled functional response for tL data (gaia2016 semifield summer)
amp,scaled functional response for tL data (gaia2016 semifield winter
amp,scaled functional response for tL data in the Gulf of Saint-Lawrence
amp,scaled functional response for tL data Teal2011
amp,scaled functional response for tL data till 1e3 d
amp,scaled functional response for tL_D data
amp,scaled functional response for tL_Der data
amp,scaled functional response for tLe_22 data
amp,scaled functional response for tLe_30 data
amp,scaled functional response for tL_e and tW_e data
amp,scaled functional response for tL_e data
amp,scaled functional response for tLe data
amp,scaled functional response for tL_E data
amp,scaled functional response for tL_E data at t=000 d
amp,scaled functional response for tL_E data at t=060 d
amp,scaled functional response for tL_E data at t=120 d
amp,scaled functional response for tL_E data at t=180 d
amp,scaled functional response for tL_E data at t=240 d
amp,scaled functional response for tL_E data at t=300 d
amp,scaled functional response for tL_Eig data
amp,scaled functional response for tL_Ez data
amp,scaled functional response for tL_f
amp,scaled functional response for tL_f0 data
amp,scaled functional response for tL_f1
amp,scaled functional response for tL_f1 data
amp,scaled functional response for tL_f2
amp,scaled functional response for tL_f2 data
amp,scaled functional response for tL_f3
amp,scaled functional response for tL_f3 and tL_m3 data
amp,scaled functional response for tL_f3 data
amp,scaled functional response for tL_f8 and tL_m8 data
amp,scaled functional response for tL_fA
amp,scaled functional response for tL_fa data
amp,scaled functional response for tL_f and tL_m data
amp,scaled functional response for tL_FC data
amp,scaled functional response for tL_f data
amp,scaled functional response for tL_F data
amp,scaled functional response for tL_FFS data
amp,scaled functional response for tL_Fit data
amp,scaled functional response for tL_fld data
amp,scaled functional response for tL_FLE data
amp,scaled functional response for tL_Fli data
amp,scaled functional response for tL_fNZ
amp,scaled functional response for tL_G data
amp,scaled functional response for tL_Ge data
amp,scaled functional response for tL_Gu data
amp,scaled functional response for tL_H and tWw_H data
amp,scaled functional response for tL_h data
amp,scaled functional response for tL_H data
amp,scaled functional response for tL_I and tWw_I data
amp,scaled functional response for tLI data
amp,scaled functional response for tL_I data at t=000 d
amp,scaled functional response for tL_I data at t=060 d
amp,scaled functional response for tL_I data at t=120 d
amp,scaled functional response for tL_I data at t=180 d
amp,scaled functional response for tL_I data at t=240 d
amp,scaled functional response for tL_I data at t=300 d
amp,scaled functional response for tL_Indals
amp,scaled functional response for tL in Guzhenkou Bay
amp,scaled functional response for tL in Laoshan Bay
amp,scaled functional response for tL_It data
amp,scaled functional response for tLj data
amp,scaled functional response for tL_J data
amp,scaled functional response for tLJ data
amp,scaled functional response for tL_K and tWw_K data
amp,scaled functional response for tL_K data
amp,scaled functional response for tLK data
amp,scaled functional response for tL_KS data
amp,scaled functional response for tL_KUR data
amp,scaled functional response for tL_La data
amp,scaled functional response for tL_LAY data
amp,scaled functional response for tL_l data
amp,scaled functional response for tL_L data
amp,scaled functional response for tL_Limuri
amp,scaled functional response for tL_LISdata
amp,scaled functional response for tL_Llyn
amp,scaled functional response for tL_m1 data
amp,scaled functional response for tL_m2 data
amp,scaled functional response for tL_Ma data
amp,scaled functional response for tL_Mar data
amp,scaled functional response for tL_m data
amp,scaled functional response for tL_M data
amp,scaled functional response for tLM data
amp,scaled functional response for tL_MDY data
amp,scaled functional response for tL_ME data
amp,scaled functional response for tL_MHI data
amp,scaled functional response for tL_Mo data
amp,scaled functional response for tL_MR data
amp,scaled functional response for tL_Mu data
amp,scaled functional response for tL_MW data
amp,scaled functional response for tL_N data
amp,scaled functional response for tLN data
amp,scaled functional response for tL_O data
amp,scaled functional response for tL_OL data
amp,scaled functional response for tL_OO data
amp,scaled functional response for tL_OR data
amp,scaled functional response for tL_P data
amp,scaled functional response for tLP data
amp,scaled functional response for tL_Pedro data
amp,scaled functional response for tL_PHR data
amp,scaled functional response for tL_PR data
amp,scaled functional response for tLr data
amp,scaled functional response for tL_R data
amp,scaled functional response for tL_Robe data
amp,scaled functional response for tL_Roe data
amp,scaled functional response for tL_Rop data
amp,scaled functional response for tL_SA data
amp,scaled functional response for tL_S and tWw_S data
amp,scaled functional response for tL_SB data
amp,scaled functional response for tL_SC data
amp,scaled functional response for tL_S data
amp,scaled functional response for tLS data
amp,scaled functional response for tL_SK1
amp,scaled functional response for tL_SK2
amp,scaled functional response for tL_SK3
amp,scaled functional response for tL_spat data
amp,scaled functional response for tL_spr data
amp,scaled functional response for tL_Spr data
amp,scaled functional response for tL_SR data
amp,scaled functional response for tL_Storsjo
amp,scaled functional response for tL_Stura data
amp,scaled functional response for tL_sum data
amp,scaled functional response for tL_T*
amp,scaled functional response for tL_T and tWw_T data
amp,scaled functional response for tL_t data
amp,scaled functional response for tL_T data
amp,scaled functional response for tLT data
amp,scaled functional response for tL_T datasets
amp,scaled functional response for tL_Test
amp,scaled functional response for tL & tW data at 15 m deep
amp,scaled functional response for tL & tW data at 30 m deep
amp,scaled functional response for tL/tW data for females and males
amp,scaled functional response for tL_UK and LN_UK data
amp,scaled functional response for tL_w data
amp,scaled functional response for tL_W data
amp,scaled functional response for tL_Wils and tWd_Wils data
amp,scaled functional response for tN data
amp,scaled functional response for Tt2 data
amp,scaled functional response for Tte data
amp,scaled functional response for Tull data
amp,scaled functional response for Tung data
amp,scaled functional response for tW
amp,scaled functional response for tW0 data
amp,scaled functional response for tW0 data at >15 1d
amp,scaled functional response for tW100 data
amp,scaled functional response for tW14 data
amp,scaled functional response for tW1 data
amp,scaled functional response for tW1 data at 000 d
amp,scaled functional response for tW1 data at 00 d
amp,scaled functional response for tW1 data at 02 d
amp,scaled functional response for tW1 data at 03 d
amp,scaled functional response for tW1 data at 04 d
amp,scaled functional response for tW1 data at 05 d
amp,scaled functional response for tW1 data at 06 d
amp,scaled functional response for tW1 data at 070 d
amp,scaled functional response for tW1 data at 08 d
amp,scaled functional response for tW1 data at 10 d
amp,scaled functional response for tW1 data at 110 d
amp,scaled functional response for tW1 data at 15 d
amp,scaled functional response for tW1 data at 17 d
amp,scaled functional response for tW1 data at 20 d
amp,scaled functional response for tW1 data at 25 d
amp,scaled functional response for tW1 data at 30 d
amp,scaled functional response for tW1 data at 35 d
amp,scaled functional response for tW1 data at 65 d
amp,scaled functional response for tW1 data at 99 d
amp,scaled functional response for tW1 data from 0-8 d
amp,scaled functional response for tW2
amp,scaled functional response for tW20 data
amp,scaled functional response for tW2 and tW1 data
amp,scaled functional response for tW2 data
amp,scaled functional response for tW2 data at 00 d
amp,scaled functional response for tW2 data at 02 d
amp,scaled functional response for tW2 data at 04 d
amp,scaled functional response for tW2 data at 06 d
amp,scaled functional response for tW2 data at 08 d
amp,scaled functional response for tW2 data at 17 d
amp,scaled functional response for tW2 data from 0-8 d
amp,scaled functional response for tW3 data
amp,scaled functional response for tW3 data at 9 d
amp,scaled functional response for tW3 data  from 0-6 d
amp,scaled functional response for tW45 data
amp,scaled functional response for tW4 data
amp,scaled functional response for tW5 data
amp,scaled functional response for tW_66 data at 00 d
amp,scaled functional response for tW_66 data at 10 d
amp,scaled functional response for tW_66 data at 20 d
amp,scaled functional response for tW_66 data at 30 d
amp,scaled functional response for tW_67 data at 00 d
amp,scaled functional response for tW_67 data at 10 d
amp,scaled functional response for tW_67 data at 20 d
amp,scaled functional response for tW_67 data at 30 d
amp,scaled functional response for tW6 data
amp,scaled functional response for tW75 data
amp,scaled functional response for tW8 data
amp,scaled functional response for tW9 data
amp,scaled functional response for tW and tL data
amp,scaled functional response for tW and tW1 data
amp,scaled functional response for tW_As data
amp,scaled functional response for tW_B data
amp,scaled functional response for tW_BH data
amp,scaled functional response for tW_*C data
amp,scaled functional response for tW  data
amp,scaled functional response for tW data
amp,scaled functional response for tWdata
amp,scaled functional response fortW data
amp,scaled functional response for tW data after puberty
amp,scaled functional response for tW data after t_W0
amp,scaled functional response for tW data after t_W1
amp,scaled functional response for tW data at 0000 d
amp,scaled functional response for tW data at 000 d
amp,scaled functional response for tW data at 00 d
amp,scaled functional response for tW data at 010 d
amp,scaled functional response for tW data at 015 d
amp,scaled functional response for tW data at 020 d
amp,scaled functional response for tW data at 02 d
amp,scaled functional response for tW data at 030 d
amp,scaled functional response for tW data at 03 d
amp,scaled functional response for tW data at 040 d
amp,scaled functional response for tW data at 04 d
amp,scaled functional response for tW data at 050 d
amp,scaled functional response for tW data at 05 d
amp,scaled functional response for tW data at 060 d
amp,scaled functional response for tW data at 065 d
amp,scaled functional response for tW data at 06 d
amp,scaled functional response for tW data at 070 d
amp,scaled functional response for tW data at 075 d
amp,scaled functional response for tW data at 07 d
amp,scaled functional response for tW data at 080 d
amp,scaled functional response for tW data at 08 d
amp,scaled functional response for tW data at 090 d
amp,scaled functional response for tW data at 09 d
amp,scaled functional response for tW data at 0 d
amp,scaled functional response for tW data at 1000 d
amp,scaled functional response for tW data at 100 d
amp,scaled functional response for tW data at 105 d
amp,scaled functional response for tW data at <10 d
amp,scaled functional response for tW data at 10 d
amp,scaled functional response for tW data at 110 d
amp,scaled functional response for tW data at 120 d
amp,scaled functional response for tW data at 12 d
amp,scaled functional response for tW data at 130 d
amp,scaled functional response for tW data at 13 d
amp,scaled functional response for tW data at 14000 d
amp,scaled functional response for tW data at 140 d
amp,scaled functional response for tW data at 14 d
amp,scaled functional response for tW data at 150 d
amp,scaled functional response for tW data at <15 d
amp,scaled functional response for tW data at >15 d
amp,scaled functional response for tW data at 15 d
amp,scaled functional response for tW data at 160 d
amp,scaled functional response for tW data at 16 d
amp,scaled functional response for tW data at 170 d
amp,scaled functional response for tW  data at 17 d
amp,scaled functional response for tW data at 17 d
amp,scaled functional response for tW data at 180 d
amp,scaled functional response for tW data at 18 d
amp,scaled functional response for tW data at 19 d
amp,scaled functional response for tW data at 2000 d
amp,scaled functional response for tW data at 200 d
amp,scaled functional response for tW data at <20 d
amp,scaled functional response for tW data at 20 d
amp,scaled functional response for tW data at 21 d
amp,scaled functional response for tW data at 23 d
amp,scaled functional response for tW data at 24 d
amp,scaled functional response for tW data at 250 d
amp,scaled functional response for tW data at 25 d
amp,scaled functional response for tW data at 26 d
amp,scaled functional response for tW data at 27 d
amp,scaled functional response for tW data at 28 d
amp,scaled functional response for tW data at 3000 d
