datasetId,traitNameVerbatim
amp,age at switch from zooplankton to fish
amp,allocation fraction of milk (vs fetus)
amp,allocation fraction of milk (vs foetus)
amp,allocation fraction to soma
amp,allocation fraction to soma at birth till metam
amp,allocation fraction to soma at hatch and after metam
amp,allocation fraction to soma before h and after j
amp,allocation fraction to soma beteen b and j
amp,amplitude of scaled functional response for tW data
amp,arm length at time zero in tL data
amp,Arrhenius temp
amp,Arrhenius temp at upper boundary
amp,Arrhenius temperature
amp,Arrhenius Temperature
amp,Arrhenius temperature 1st instar
amp,Arrhenius temperature 2nd instar
amp,Arrhenius temperature 3rd instar
amp,Arrhenius temperature 4th instar
amp,Arrhenius temperature 5th instar
amp,Arrhenius temperature 5th instar and higher
amp,Arrhenius temperature above the upper boundary
amp,Arrhenius temperature at high boundary
amp,Arrhenius temperature  at high temp boundary
amp,Arrhenius temperature at low boundary
amp,Arrhenius temperature at lower  boundary
amp,Arrhenius temperature at lower boundary
amp,Arrhenius temperature at lower boundary temperature
amp,Arrhenius temperature  at low temp boundary
amp,Arrhenius temperature  at upper boundary
amp,Arrhenius temperature at upper boundary
amp,Arrhenius temperature at upper boundary 5th instar and higher
amp,Arrhenius temperature at upper boundary egg
amp,Arrhenius temperature below the lower boundary
amp,Arrhenius temperature egg
amp,Arrhenius temperature for 1st instar
amp,Arrhenius temperature for fast development
amp,Arrhenius temperature for high end of range
amp,Arrhenius temperature for larval mortality
amp,Arrhenius temperature for low end of range
amp,Arrhenius temperature for lower boundary
amp,Arrhenius temperature for T_H
amp,Arrhenius temperature for T_L
amp,Arrhenius temperature for upper boundary
amp,Arrhenius temperature high boundary
amp,Arrhenius temperature pupa
amp,Arrh. temp for lower boundary
amp,Arrh. temp for upper boundary
amp,ash-free dry - dry weight ratio
amp,background hazard during larval stage
amp,background hazard rate
amp,background hazard rate coefficient
amp,background hazard rate (Wage2015)
amp,bell diameter of ephedra neonate
amp,body length at 0 in tL_f data
amp,body length at 0 in tL_m data
amp,body length at time zero
amp,carbon density of structure
amp,CCL shape coefficient of adults
amp,chem coeff for Carb in reserve
amp,chem coeff for Carb in structure
amp,chem coeff for Glyc in reserve
amp,chem coeff for Glyc in structure
amp,chem coeff for Lipi in reserve
amp,chem coeff for Lipi in structure
amp,chem coeff for Prot in reserve
amp,chem coeff for Prot in structure
amp,chem coeff for Trig in reserve
amp,chem coeff for Trig in structure
amp,contibution of shell in tWd_A till tWd_D data
amp,contribution of gonads in weight for tW-data
amp,contribution of reprod buffer to total trunc length
amp,conversion efficiency E -> V -> E
amp,conversion efficiency from larval reserve to larval structure
amp,conversion efficient E -> V -> E
amp,conversion factor for RMI
amp,conversion length: L_w = L_s^2/ L_M
amp,conversion of g soil to J for cast production
amp,conversion of mg carbon to J for algal food (Desmodesmus subspicatus)
amp,coupler ingested energy - faecal pellet number
amp,CTmax for Arrhenius temperature_Hemmings PhD data
amp,CTmin for Arrhenius temperature_Dodgy data
amp,defacation efficiency
amp,defecation efficiency
amp,delay for onset of growth in tW data
amp,del_M
amp,del_Mb
amp,del_Mj
amp,determines energy allocation to pups
amp,diameter at start experiment
amp,digestion efficiency
amp,digestion efficiency for growth selected cohort
amp,digestion efficiency for milk
amp,digestion efficiency of 01
amp,digestion efficiency of 03
amp,digestion efficiency of 04
amp,digestion efficiency of 05
amp,digestion efficiency of 07
amp,digestion efficiency of food to reserve
amp,digestion efficiency of food to reserve at high supply
amp,digestion efficiency of food to reserve at low food
amp,digestion efficiency of food to reserve at low supply
amp,digestion efficiency of food to reserve for tW2 data
amp,digestion efficiency of food to reserve low food
amp,digestion efficiency of milk
amp,dry - ash free dry weight ratio
amp,dryweight at t = 0 in tW-data
amp,dry weight for TJO and TJN data
amp,dry weight for TJO data
amp,[E_G]
amp,E_Hb
amp,E_Hh
amp,E_Hj
amp,E_Hp
amp,embryo shape coefficient
amp,energy conductance
amp,energy conductance-embryos
amp,energy conductance for embryo
amp,energy conductance for males
amp,energy conductance of embryo
amp,energy conductance post birth
amp,energy conductance pre birth
amp,energy content of a Skeletonema cell
amp,energy content per cell Phaeodactylum tricornutum
amp,energy in food for tW2 data
amp,energy in repro buffer at the beginning of pregnancy
amp,eR at start starvation
amp,f
amp,factor for foetal development
amp,f_ad_lib
amp,faecation efficiency of food to faeces
amp,f_Deniel & Devauchelle
amp,feacation efficiency of food to feaces
amp,fetus max surf-spec assimilation rate
amp,f for Day (larvae)
amp,f for Fonds1977 (ingestion)
amp,f for Fonds 1979 (larvae)
amp,f for Galois (larvae)
amp,f for Lund (larvae)
amp,f for males 0392 data
amp,f for males 2598 data
amp,f for pregnant females 0154
amp,f for pregnant females 0192
amp,f for pregnant females 0203
amp,f for pregnant females 0392
amp,f for pregnant females 0397
amp,f for pregnant females 1085
amp,f for pregnant females 2598
amp,{F_m}
amp,{F_M}
amp,{F_mb}
amp,foetus energy conductance
amp,foetus max surf-spec assimilation rate
amp,fraction of eggs in gonads that is resorbed
amp,fraction of imago structure energy that is converted to eggs
amp,fraction of wet weight that is measured as a result of removing all body fluids
amp,fraction of wet weight that is wet tissue
amp,fraction of yr that for accumulation in first spawn
amp,fraction that is lardar carcas weight of total weight
amp,f_tL
amp,Gompertz stress coefficient
amp,Gompertz stress coefficient for female
amp,Gompertz stress coefficient for male
amp,growth period for TdW data
amp,Gunadi
amp,h_a
amp,half sat constant for inorg matter
amp,half-saturation coeffcient
amp,half-saturation coeff for the pup saturation curve
amp,hazard rate for background mortality
amp,high Arrhenius temperature
amp,High Boundary Arrhenius temperature
amp,high boundary temperature
amp,High boundary temperature
amp,high boundary temperature egg
amp,high boundary temperature pupa
amp,high temp boundary
amp,increase in filtration rate at low food density
amp,ind10exp1
amp,ind11exp1
amp,ind12exp1
amp,ind13exp1
amp,ind14exp1
amp,ind15exp1
amp,ind16exp1
amp,ind17exp1
amp,ind18exp1
amp,ind19exp1
amp,ind1exp1
amp,ind20exp1
amp,ind21exp1
amp,ind22exp1
amp,ind23exp1
amp,ind24exp1
amp,ind25exp1
amp,ind26exp1
amp,ind27exp1
amp,ind28exp1
amp,ind29exp1
amp,ind2exp1
amp,ind30exp1
amp,ind31exp1
amp,ind32exp1
amp,ind33exp1
amp,ind34exp1
amp,ind35exp1
amp,ind36exp1
amp,ind37exp1
amp,ind3exp1
amp,ind4exp1
amp,ind5exp1
amp,ind6exp1
amp,ind7exp1
amp,ind8exp1
amp,ind9exp1
amp,initial abdomial length for tL data
amp,initial carapace width for tL data
amp,initial cumulative # of eggs in tN_100 data
amp,initial cumulative # of eggs in tN_25 data
amp,initial cumulative # of eggs in tN_50 data
amp,initial cumulative # of eggs in tN_A till tN_D data
amp,initial dry weight at for tW0T data
amp,initial dry weight at for tW1T data
amp,initial dry weight at for tW2T data
amp,initial energy in egg
amp,initial energy in reproduction buffer
amp,initial energy in the repro buffer
amp,initial f for Soho
amp,initial lardar carcas weight for female
amp,initial lardar carcas weight for male
amp,initial length for tL_1973 data
amp,initial length for tL_1974 data
amp,initial length for tL_1 data
amp,initial length for tL1 data
amp,initial length for tL_1-tL_4 data
amp,initial length for tL_2010 data
amp,initial length for tL_2011 data
amp,initial length for tL_2012 data
amp,initial length for tL_2013 data
amp,initial length for tL_2 and tL_3 data
amp,initial  length for tL2 data
amp,initial length for tL_2 data
amp,initial  length for tL3 data
amp,initial  length for tL4 data
amp,initial  length for tL5 data
amp,initial length for tL_5-tL_6 data
amp,initial  length for tL6 data
amp,initial  length for tL7 data
amp,initial length  for tL and tWw data
amp,initial length for tL data
amp,initial length for tL_f1 data
amp,initial length for tL_f2 data
amp,initial length for tL_f data
amp,initial length for tL_m1 data
amp,initial length for tL_m2 data
amp,initial length for tL_m data
amp,initial length for tL_spr data
amp,initial length for tL_sum data
amp,initial length in tL1 data
amp,initial length in tL and tW data
amp,initial length in tL data
amp,initial length of 1973 cohort
amp,initial length of 1974 cohort
amp,initial length of 1975 cohort
amp,initial length of 1976 cohort
amp,initial length of 1977 cohort
amp,initial length of 1978 cohort
amp,initial length of tL1 data
amp,initial length of tL data
amp,initial length tL2
amp,initial length tL3
amp,initial length tL_c (gaia2016
amp,initial length tL data Sand1981
amp,initial length tL (gaia2016
amp,initial length tL_w (gaia2016
amp,initial length tS (Wage2015)
amp,initial maturity in tL_Wils and tWd_Wils data
amp,initial reprod buffer in tWd_Mann data
amp,initial reserve
amp,initial scaled functional response for tdL data
amp,initial shell height at for tL0 data
amp,initial shell height at for tL0T data
amp,initial shell height at for tL1 data
amp,initial shell height at for tL1T data
amp,initial shell height at for tL2 data
amp,initial shell height at for tL3 data
amp,initial shell height at for tL4 data
amp,initial shell height at for tL data
amp,initial shell height for tL1 data
amp,initial shell height for tL3 data
amp,initial shell height for tL5 data
amp,initial shell height for tL data
amp,initial size for Coors data
amp,initial struct length for tL and tWw data
amp,initial struct length for tWw data
amp,initial struct length in tL_Saur data
amp,initial struct length in tL_Wils and tWd_Wils data
amp,initial struct length in tWd_Mann data
amp,initial structural length
amp,initial structural length in A till D data
amp,initial structural length in D data
amp,initial structural length in tL_100
amp,initial structural length in tL_FLE data
amp,initial structural length of 01
amp,initial structural length of 02
amp,initial structural length of 03
amp,initial structural length of 04
amp,initial structural length of 05
amp,initial structural length of 06
amp,initial structural length of 07
amp,initial structural length of 08
amp,initial structural length of 13
amp,initial time for tW-data
amp,initial TL in tL data
amp,initial weight for starvation experiment
amp,initial weight for tW1 data
amp,initial weight for tW data
amp,initial weight in tW1 data
amp,initial weight in tW data
amp,initial weight in tWw data
amp,initial weight in tWw_f data
amp,initial weight in tWw_m data
amp,initial weight of tW_fK data
amp,initial weight of tW_fO data
amp,initial wet weight for tW data
amp,initial wet weight for tWwA data
amp,initial wet weight for tWwB data
amp,initial wet weight for tWwC data
amp,initial wet weigth in tWW data
amp,intial dry weight for tWd_a data
amp,intial dry weight for tWd_d data
amp,intial dry weight for tWd_p data
amp,intial dry weight for tWd_t data
amp,intial length for tL_15 and tL_25 data
amp,intial length for tL_f data
amp,intial length for tL_fld data
amp,intial length for tL_m data
amp,intial weight for tWw data
amp,intial wet weight for tWw_d* data
amp,Intital weight in tW_m data
amp,intitial structural length in tL
amp,kap
amp,kap_P
amp,kap_R
amp,kap_X
amp,k_J
amp,larval shape coefficient
amp,L at start AlleHass1985
amp,L at start ShelClar1995
amp,length at 0 for tL_f data
amp,length at 0 for tL_m data
amp,length at 15 d for FabiHuve2005 data
amp,length at start of experiment
amp,length at start of experiment for tWw data
amp,length at t = 0 in tL_1995/6 data
amp,length at t = 0 in tL-data
amp,length at time 0
amp,length at zero
amp,length at zero fot tL_f data
amp,length at zero fot tL_m data
amp,low Arrhenius temperature
amp,Low Boundary Arrhenius temperature
amp,low boundary temperature
amp,Low boundary temperature
amp,lower Arrhenius temperature
amp,lower boundary
amp,lower boundary for Arrhenius temperature
amp,lower boundary  temperature
amp,lower boundary temperature
amp,Lower boundary temperature
amp,lower boundary tolerance range
amp,Lower temp boundary
amp,lower temperature boundary
amp,Lower temperature boundary
amp,low temp boundary
amp,mantle length at zero for tL_f data
amp,mantle length at zero for tL_m data
amp,maturity ar birth
amp,maturity at birth
amp,maturity at birth asexual stage
amp,maturity at birth for females
amp,maturity at birth for males
amp,maturity at birth sexual stage
amp,maturity at emergence
amp,maturity at end acceleration
amp,maturity at fledching
amp,maturity at fledge/weaning
amp,maturity at fledging
amp,maturity at  for males
amp,maturity at hatch
amp,maturity at hatch for male
amp,maturity at hatching
amp,maturity at metam
amp,maturity at metam for females
amp,maturity at metam for males
amp,maturity at metamorhosis
amp,maturity at metamorphosis
amp,maturity at pre-birth (when embryo starts absorbation)
amp,maturity at puberty
amp,maturity at puberty asexual stage
amp,maturity at puberty female
amp,maturity at puberty for female
amp,maturity at puberty for females
amp,maturity at puberty for male
amp,maturity at puberty for  males
amp,maturity at puberty for males
amp,maturity at puberty for malesE
amp,maturity at puberty for maless
amp,maturity at puberty form males
amp,maturity at puberty for P.a.g.
amp,maturity at puberty for race B
amp,maturity at puberty for race CS
amp,maturity at puberty for race CT
amp,maturity at puberty for race E
amp,maturity at puberty for race G
amp,maturity at puberty for race I
amp,maturity at puberty for race L
amp,maturity at puberty for race M
amp,maturity at puberty for race N
amp,maturity at puberty for race P
amp,maturity at puberty for race S
amp,maturity at puberty for race SB
amp,maturity at puberty fro males
amp,maturity at puberty from  males
amp,maturity at puberty male
amp,maturity at puberty of female
amp,maturity at puberty of male
amp,maturity at puberty of males
amp,maturity at release
amp,maturity at release of oozoid
amp,maturity at S2/S3 transition
amp,maturity at settlement
amp,maturity at start acceleration
amp,maturity at strobulation
amp,maturity at trochophore larva stage
amp,maturity at weaning
amp,maturity maintenance rate coefficient
amp,maturity maintenance ratio
amp,maturity maint rate coefficient
amp,maximum surface-specific ingestion rate
amp,max number of pups for upregulation
amp,max spec ingestion rate
amp,max spec searching rate
amp,mean scaled functional response for tL_N data
amp,mean scaled functional response for tL_S data
amp,mean scaled functional response for tW data
amp,mean temperature for tT data
amp,mean temp in North Sea
amp,mean temp in Skagerak
amp,measured initial energy of egg
amp,milk production efficiency
amp,milk production efficiency of the mother
amp,minus(!) time at start development
amp,mol Chlorophyll per Cmol food
amp,mol C per algal cell
amp,mol per cell of micro-algae in Rico-data
amp,Neuhauser cow manure
amp,Neuhauser horse manure
amp,Neuhauser sludge
amp,nitrogen density of structure
amp,NO2 stress coefficient
amp,non-ash fraction for WdWa
amp,non-ash fraction for WdWd
amp,number of zooids at time 0
amp,offset for tL data
amp,offset for T(t) in tL data
amp,oral shape coefficient
amp,{p_Am}
amp,period between broods
amp,period of metamorphosis
amp,physical length at start experiment in tL_1 and tL_2 data
amp,physical length at start experiment in tL_4 data
amp,[p_M]
amp,{p_T}
amp,radius at time 0 in tL
amp,rate of egg production
amp,ratio of shape coefficient for total length and SVL
amp,reduction factor for yolk absorption
amp,reduction factor of structure and reserve mass at j
amp,reference for structural length for digestion efficiency
amp,reference scaled functional response
amp,Reference temperature
amp,rejuvenation stress coefficient
amp,reprod buffer/structure at pupation as fraction of max
amp,reproduction buffer density at emergence
amp,reproduction buffer density at pupation
amp,reproduction buffer turnover of imago
amp,reproduction efficiency
amp,reproduction efficiency of the mother
amp,scaled func res
amp,scaled func. response for 0-var data
amp,scaled functional for tL data
amp,scaled functional response
amp,scaled functional response at 120 paramecia/d
amp,scaled functional response at 20 paramecia/d
amp,scaled functional response at 240 paramecia/d
amp,scaled functional response at 30 paramecia/d
amp,scaled functional response at 60 paramecia/d
amp,scaled functional response at Beagle bed
amp,scaled functional response at Explorer Cove
amp,scaled functional response at high food
amp,scaled functional response at Khuchni
amp,scaled functional response at Kostek
amp,scaled functional response at Kuli
amp,scaled functional response at low food
amp,scaled functional response at Sergokala
amp,scaled functional response at Termenlik
amp,scaled functional response at Terra Nova Bay in December
amp,scaled functional response at Terra Nova Bay in January
amp,scaled functional response at Urugay bed
amp,scaled functional response between b and j
amp,scaled functional response between b and x
amp,scaled functional response between j and m
amp,scaled functional response embryo data  ZaikDom2013
amp,scaled functional response for 0.06 ration
amp,scaled functional response for 0.12 ration
amp,scaled functional response for 0.25 ration
amp,scaled functional response for 0.5 ration
amp,scaled functional response for 0-var and 1-var data
amp,scaled functional response for 0-var and ad libitum data
amp,scaled functional response for 0-var and tL data
amp,scaled functional response for 0-var and tW6 data
amp,scaled functional response for 0-var and tW data
amp,scaled functional response for 0-var and tWe data
amp,scaled functional response for 0-var data
amp,scaled functional response for 0-var data from the field
amp,scaled functional response for 0-var data on yeast
amp,scaled functional response for 0-var (wild) data
amp,scaled functional response for 1-LN data
amp,scaled functional response for 1-var data
amp,scaled functional response for 1-var data birth onwards
amp,scaled functional response for 1-var data Clutch 1 embryo
amp,scaled functional response for 1-var data Clutch 2 embryo
amp,scaled functional response for 1-var data Clutch 3 embryo
amp,scaled functional response for 1-var data Clutch 4 embryo
amp,scaled functional response for 1-var data Clutch 5 embryo
amp,scaled functional response for 1-var data Clutch 6 embryo
amp,scaled functional response for 1-var data for captive reared
amp,scaled functional response for 1-var data (KR13)
amp,scaled functional response for 1-var data (KR15)
amp,scaled functional response for 1-var data of olive (fed)
amp,scaled functional response for 1-var data of olive (unfed)
amp,scaled functional response for 1-var data (oxygen)
amp,scaled functional response for 1-var data (reproduction)
amp,scaled functional response for 1-var data (Vargas2014)
amp,scaled functional response for 1-var tW data
amp,scaled functional response for advanced hatched
amp,scaled functional response for Aerl2004
amp,scaled functional response for AlleHass1985 data
amp,scaled functional response for BeacMurr1993 data
amp,scaled functional response for BjorStei2007 data
amp,scaled functional response for BoroTaly2015
amp,scaled functional response for Brazil data
amp,scaled functional response for Butt1993 data
amp,scaled functional response for CasaLape2011 data
amp,scaled functional response for ChanDeSi1981
amp,scaled functional response for CharShri2004 data
amp,scaled functional response for Cian1979 data
amp,scaled functional response for Clinch River data
amp,scaled functional response for clutch B
amp,scaled functional response for clutch F
amp,scaled functional response for clutch H
amp,scaled functional response for clutch X
amp,scaled functional response for CripHemm2009
amp,scaled functional response for CripHemm2009 Brine shrimp food
amp,scaled functional response for CripHemm2009 combination Brine shrimp and Flake food
amp,scaled functional response for CripHemm2009 Flake food
amp,scaled functional response for ctrl in Elli1980
amp,scaled functional response for ctrl in Zhan2010
amp,scaled functional response for data1
amp,scaled functional response for data2
amp,scaled functional response for data3
amp,scaled functional response for data4
amp,scaled functional response for data from Eighty Mile Beach
amp,scaled functional response for data from Thevenard Island
amp,scaled functional response for deprivation group in Wood1996
amp,scaled functional response for de wilde data unfed
amp,scaled functional response for DomiLee1998 data
amp,scaled functional response for DomiLee1999 data
amp,scaled functional response for Duck River data
amp,scaled functional response for dWd
amp,scaled functional response for Early James
amp,scaled functional response for egg data
amp,scaled functional response for experimental data
amp,scaled functional response for F3 food condition
amp,scaled functional response for FabiHuve2005 data
amp,scaled functional response for farm data
amp,scaled functional response for FBL data
amp,scaled functional response for f data
amp,scaled functional response for feeding data
amp,scaled functional response for field
amp,scaled functional response for fish fed 2 perc/d
amp,scaled functional response for fish fed 4 perc/d
amp,scaled functional response for fish fed 6 perc/d
amp,scaled functional response for f_JX
amp,scaled functional response for f_LdL
amp,scaled functional response for f_LF
amp,scaled functional response for f_LN
amp,scaled functional response for Flowerdew
amp,scaled functional response for flux data
amp,scaled functional response for food restriction
amp,scaled functional response for FR50 in Zhan2010
amp,scaled functional response for Frost1943
amp,scaled functional response for fsubtidal data
amp,scaled functional response for f_tL
amp,scaled functional response for f_tL data
amp,scaled functional response for f_tW1 data
amp,scaled functional response for f_tW data
amp,scaled functional response for gaia2019 data
amp,scaled functional response for Gonz2002 0-var data
amp,scaled functional response for Gonz2010
amp,scaled functional response for GoulWolo2004 data
amp,scaled functional response for GreaGutj2011 data
amp,scaled functional response for growth
amp,scaled functional response for GuptMich1993 data
amp,scaled functional response for hand reared pups
amp,scaled functional response for Hees1984
amp,scaled functional response for Hlop2011 wild fish
amp,scaled functional response for HopkMack1953 data
amp,scaled functional response for imago
amp,scaled functional response for in situ tL data
amp,scaled functional response for instar 4 data
amp,scaled functional response for Itenez basina
amp,scaled functional response for JoneHyne1950 data
amp,scaled functional response for juv Lyon1962
amp,scaled functional response for Kill2014
amp,scaled functional response for KozaBuri2009 data
amp,scaled functional response for Kuhn2001
amp,scaled functional response for L0Lt data
amp,scaled functional response for lab data
amp,scaled functional response for Latest James
amp,scaled functional response for LdL
amp,scaled functional response for LdL1 data
amp,scaled functional response for LdL2 data
amp,scaled functional response for LdL3 data
amp,scaled functional response for LdL_a data
amp,scaled functional response for LdL_b data
amp,scaled functional response for LdL data
amp,scaled functional response for length - dry weight data Beck2011
amp,scaled functional response for length - dry weight data Haue2011
amp,scaled functional response for length-weight data of DonaHata1911
amp,scaled functional response for Li_ref data
amp,scaled functional response for LJO data
amp,scaled functional response for LL135 data
amp,scaled functional response for LL79 data
amp,scaled functional response for LL and WW data
amp,scaled functional response for LL and WwWw data
amp,scaled functional response for LL data
amp,scaled functional response for LLm data
amp,scaled functional response for LLs data
amp,scaled functional response for LMO data
amp,scaled functional response for LN_0 data
amp,scaled functional response for LN_112 data
amp,scaled functional response for LN_11 data
amp,scaled functional response for LN_12 data
amp,scaled functional response for LN_13 data
amp,scaled functional response for LN_16 data
amp,scaled functional response for LN_18 data
amp,scaled functional response for LN_19 data
amp,scaled functional response for LN_3 data
amp,scaled functional response for LN_6 data
amp,scaled functional response for LN data
amp,scaled functional response for LN data WittGree1995
amp,scaled functional response for LN_N data
amp,scaled functional response for Lr data
amp,scaled functional response for LW1 data
amp,scaled functional response for LW data
amp,scaled functional response for LWd data
amp,scaled functional response for LWd_sygny data
amp,scaled functional response for LWw data
amp,scaled functional response for LWw_f data
amp,scaled functional response for males in Baye2005
amp,scaled functional response for Mamore basina
amp,scaled functional response for Manchado pers.comm. (aquaculture) data
amp,scaled functional response for MannSout2009 data
amp,scaled functional response for mar data
amp,scaled functional response for Mark2011 data
amp,scaled functional response for maternally reared pups
amp,scaled functional response for McCoGeub2006 data
amp,scaled functional response for McKe1987 food regime 1
amp,scaled functional response for McKe1987 food regime 2
