datasetId,traitNameVerbatim
amp,scaled functional response for tW data at 300 d
amp,scaled functional response for tW data at <30 d
amp,scaled functional response for tW data at 30 d
amp,scaled functional response for tW data at 32 d
amp,scaled functional response for tW data at 350 d
amp,scaled functional response for tW data at 35 d
amp,scaled functional response for tW data at 36 d
amp,scaled functional response for tW data at 370 d
amp,scaled functional response for tW data at 3 d
amp,scaled functional response for tW data at 4000 d
amp,scaled functional response for tW data at 40 d
amp,scaled functional response for tW data at 45 d
amp,scaled functional response for tW data at 5000 d
amp,scaled functional response for tW data at >50 d
amp,scaled functional response for tW data at 50 d
amp,scaled functional response for tW data at 5.5 d
amp,scaled functional response for tW data at 55 d
amp,scaled functional response for tW data at <5 d
amp,scaled functional response for tW data at 6000 d
amp,scaled functional response for tW data at >60 d
amp,scaled functional response for tW data at 60 d
amp,scaled functional response for tW data at 65 d
amp,scaled functional response for tW data at 6 d
amp,scaled functional response for tW data at 70 d
amp,scaled functional response for tW data at 75 d
amp,scaled functional response for tW data at 7 d
amp,scaled functional response for tW data at 80 d
amp,scaled functional response for tW data at 90 d
amp,scaled functional response for tW data at 99 d
amp,scaled functional response for tW data at 9 d
amp,scaled functional response for tW data at t=0 d
amp,scaled functional response for tW data at t=40 d
amp,scaled functional response for tW data between b and x
amp,scaled functional response for tW data between x and i
amp,scaled functional response for tW data col 2
amp,scaled functional response for tW data col 3
amp,scaled functional response for tW data col 4
amp,scaled functional response for tW  data from 0-8 d
amp,scaled functional response for tW data from BergChaz1976
amp,scaled functional response for tW data from Mahm2013 FEMALES double lactation
amp,scaled functional response for tW data from Mahm2013 FEMALES single lactation
amp,scaled functional response for tW data from Mahm2013 MALES double lactation
amp,scaled functional response for tW data from Mahm2013 MALES single lactation
amp,scaled functional response for tW data from MasoShap1986 FEMALES
amp,scaled functional response for tW data from MasoShap1986 MALES
amp,scaled functional response for tW data on filter paper
amp,scaled functional response for tW data till puberty
amp,scaled functional response for tWd_f1 data
amp,scaled functional response for tWd_f2 data
amp,scaled functional response for tWd_f3 data
amp,scaled functional response for tWd_f4 data
amp,scaled functional response for tWd_Laba data
amp,scaled functional response for tWd larval data
amp,scaled functional response for tWd_Mann data
amp,scaled functional response for tWe_1978 data
amp,scaled functional response for tWe_1979 data
amp,scaled functional response for tW_Er data
amp,scaled functional response for tW_f
amp,scaled functional response for tW_f and tW_m data
amp,scaled functional response for tW_f data
amp,scaled functional response for tW_*F data
amp,scaled functional response for tWh data at 00 d
amp,scaled functional response for tWh data at 10 d
amp,scaled functional response for tWh data at 20 d
amp,scaled functional response for tWh data at 30 d
amp,scaled functional response for tWh data at 40 d
amp,scaled functional response for tWh data at 50 d
amp,scaled functional response for tWh data at 60 d
amp,scaled functional response for tWi data
amp,scaled functional response for tW_*K data
amp,scaled functional response for tWl data at 00 d
amp,scaled functional response for tWl data at 10 d
amp,scaled functional response for tWl data at 20 d
amp,scaled functional response for tWl data at 30 d
amp,scaled functional response for tWl data at 40 d
amp,scaled functional response for tWl data at 50 d
amp,scaled functional response for tWl data at 60 d
amp,scaled functional response for tW_Ma data
amp,scaled functional response for tW_m and tW_f data
amp,scaled functional response for tWN data
amp,scaled functional response for tW_*O data
amp,scaled functional response for tW_P83 data
amp,scaled functional response for tW_PC81 data
amp,scaled functional response for tW_PC82 data
amp,scaled functional response for tW_PC83 data
amp,scaled functional response for tWp data at 00 d
amp,scaled functional response for tWp data at 05 d
amp,scaled functional response for tWp data at 10 d
amp,scaled functional response for tWp data at 15 d
amp,scaled functional response for tWp data at 20 d
amp,scaled functional response for tW_Pm data
amp,scaled functional response for tW_SD data
amp,scaled functional response for tW_T33 data
amp,scaled functional response for tW_T34 data
amp,scaled functional response for tW_T43 data
amp,scaled functional response for tW/tL data
amp,scaled functional response for tWw1
amp,scaled functional response for tWw2
amp,scaled functional response for tWwA data
amp,scaled functional response for tWwB data
amp,scaled functional response for tWwC data
amp,scaled functional response for t-Ww data
amp,scaled functional response for tWw data
amp,scaled functional response for tWw_* data
amp,scaled functional response for tWw data for 15 d
amp,scaled functional response for tWw data form 0 to 90 d
amp,scaled functional response for tWw data form 90 to 135 d
amp,scaled functional response for tWw data from 0-10 d
amp,scaled functional response for tWw_d data
amp,scaled functional response for tWw_f data
amp,scaled functional response for tWw_m data at 2500 d
amp,scaled functional response for tWw_m data till 1400 d
amp,scaled functional response for tW_Y data
amp,scaled functional response for u5 control
amp,scaled functional response for univar data Angu1932; not used if embryo data calculated by dget_EVH_AF
amp,scaled functional response for uni-vars data
amp,scaled functional response for Ursi1967 data
amp,scaled functional response for Uruguay data
amp,scaled functional response for WdJO1 data
amp,scaled functional response for WdJO data
amp,scaled functional response for WdW data
amp,scaled functional response for weight data
amp,scaled functional response for west coast
amp,scaled functional response for WeylHech1998
amp,scaled functional response for wild 1-var data
amp,scaled functional response for WJO data at 10 <U+FFFD>C
amp,scaled functional response for WJO data at 19 <U+FFFD>C
amp,scaled functional response for WJO data at 1 <U+FFFD>C
amp,scaled functional response for WJO data at 3 <U+FFFD>C
amp,scaled functional response for WJO data at 6 <U+FFFD>C
amp,scaled functional response for WJO data at 8 <U+FFFD>C
amp,scaled functional response for WJO data from GranCran1991
amp,scaled functional response for WO data
amp,scaled functional response for Wood1996
amp,scaled functional response for WrigWoot2004 data
amp,scaled functional response for WW data
amp,scaled functional response for WwR data
amp,scaled functional response for WX data
amp,scaled functional response for YufeParr1999 data
amp,scaled functional response from birth to weaning
amp,scaled functional response from experiment Chiantore
amp,scaled functional response in north austral zone
amp,scaled functional response in south austral zone
amp,scaled functional response in summer for tL1 data
amp,scaled functional response in summer for tL data
amp,scaled functional response in winter for tL1 data
amp,scaled functional response in winter for tL data
amp,scaled functional response of BagaPels2001 data
amp,scaled functional response of BestAdat2010 data
amp,scaled functional response of Borg1989
amp,scaled functional response of EatoFarl1974b data
amp,scaled functional response of Inge1998
amp,scaled functional response of LawrEber2002_high data
amp,scaled functional response of LawrEber2002_low data
amp,scaled functional response of Lind1982
amp,scaled functional response of Math1971
amp,scaled functional response of OthmPasc2001
amp,scaled functional response of Pede2013
amp,scaled functional response of Schi2002 data
amp,scaled functional response Pery2005 0.04 mg
amp,scaled functional response Pery2005 0.06 mg
amp,scaled functional response Pery2005 0.1 mg
amp,scaled functional response Pery2005 0.2 mg
amp,scaled functional response Pery2005 0.3 mg
amp,scaled functional response pre-weaning for tW_B data
amp,scaled functional response pre-weaning for tW_Y data
amp,scaled functional response (Wage2015)
amp,scaled function respons
amp,scaled function response
amp,scaled funct. res. low food level
amp,scaled funct. res. medium food level
amp,scaled funct. response for tL data
amp,scaled funct. res. tW2
amp,scaled funct. res. tW3
amp,scaled reproduction buffer density
amp,scaled res density at start of experiment
amp,scaled reserve density of 01
amp,scaled reserve density of 02
amp,scaled reserve density of 03
amp,scaled reserve density of 04
amp,scaled reserve density of 05
amp,scaled reserve density of 06
amp,scaled reserve density of 07
amp,scaled reserve density of 08
amp,scaled reserve density of 13
amp,scaling coeff for hind-foot length
amp,scaling exponent for LW data
amp,sc. func. res.
amp,sc func res bay of brest
amp,sc. func. res. BoucMoll2016
amp,sc func res Celtic sea
amp,sc. func. res. HopGrah1995
amp,sc. func. resp.
amp,sc. func. resp. GonzCarb2016
amp,sc. func. resp. HaseKand2016
amp,sc func res Traena
amp,sc. funct. res.  0.1 mg tetramin per ind
amp,sc. funct. res.  0.2 mg tetramin per ind
amp,sc. funct. res.  0.3 mg tetramin per ind
amp,sc. funct. res.  0.4 mg tetramin per ind
amp,sc. funct. res.  Wagn1990
amp,scld. fctl. res.  DaviKenn2014 (first part of experiment)
amp,scld. fctl. res.  DaviKenn2014 (second part of experiment)
amp,scld. fctl. res. u13 - 3
amp,scld. fctl. res. u13 - ad libitum
amp,scld. fctl. res. univar-10 F - 3-3wk 7
amp,scld. fctl. res. YaniHisa2002
amp,SCL shape coefficient
amp,SCL shape coefficient of adults
amp,s_G
amp,shape coeff for body length
amp,shape coeff. for total length
amp,shape coefficient
amp,shape coefficient adult
amp,shape coefficient after metam
amp,shape coefficient after metamorphosis
amp,shape coefficient ar birth
amp,shape coefficient at birth
amp,shape coefficient at hatching
amp,shape coefficient at settlement
amp,shape coefficient before metam
amp,shape coefficient before metamorphosis
amp,shape coefficient CCL
amp,shape coefficient crown-rump length
amp,shape coefficient for abj
amp,shape coefficient for adult
amp,shape coefficient for bell diameter lappet to lappet
amp,shape coefficient for bell diameter rhopalia to rhopalia
amp,shape coefficient for body length
amp,shape coefficient for carapace length
amp,shape coefficient for carinal length
amp,shape coefficient for diameter
amp,shape coefficient for disc width
amp,shape coefficient for early juvenile
amp,shape coefficient for egg
amp,shape coefficient for egg diameter
amp,shape coefficient for egg/larva
amp,shape coefficient for embryo
amp,shape coefficient for embryo and larvae
amp,shape coefficient for embryo carapace length
amp,shape coefficient for embryo crown-rump length
amp,shape coefficient for embryo length
amp,shape coefficient for embryo (mean shape coeff. between time at fertilization and time at birth)
amp,shape coefficient for embryo/neonate
amp,shape coefficient for embryos
amp,shape coefficient forewing length
amp,shape coefficient for experiment
amp,shape coefficient for female
amp,shape coefficient for females
amp,shape coefficient for field data
amp,shape coefficient for FL
amp,shape coefficient for foetus
amp,shape coefficient for for curved carapace length
amp,shape coefficient for fork length
amp,shape coefficient for frog
amp,shape coefficient for head capsule of larva
amp,shape coefficient for head-capsule width
amp,shape coefficient for head length
amp,shape coefficient for headlength
amp,shape coefficient for head-rump length
amp,shape coefficient for imago
amp,shape coefficient for juvenile and adult
amp,shape coefficient for juveniles (tentaculate stage + transitional stage)
amp,shape coefficient fork length
amp,shape coefficient for larva
amp,shape coefficient for larvae
amp,shape coefficient for larvae and adults
amp,shape coefficient for larva length
amp,shape coefficient for late juvenile/adult
amp,shape coefficient for leptocephali
amp,shape coefficient for LWw data
amp,shape coefficient for male
amp,shape coefficient for males
amp,shape coefficient for neonate
amp,shape coefficient for nymph
amp,shape coefficient for operculum
amp,shape coefficient for oral-aboral length
amp,shape coefficient for otolith rarius
amp,shape coefficient for Park1926 and HildHats1927
amp,shape coefficient for polar length
amp,shape coefficient for shell diameter
amp,shape coefficient for shell heigth
amp,shape coefficient for snout-to-vent length
amp,shape coefficient for spawners
amp,shape coefficient for standard length
amp,shape coefficient for straight  carapace length
amp,shape coefficient for (sub)imago
amp,shape coefficient for SVL
amp,shape coefficient for SVL length for tadpole
amp,shape coefficient for tadpole
amp,shape coefficient for tibia length
amp,shape coefficient for TL
amp,shape coefficient for tL data
amp,shape coefficient for toad
amp,shape coefficient for total length
amp,shape coefficient for total length at hatch/birth
amp,shape coefficient for total length at hatching and birth
amp,shape coefficient for total length for intertidal population
amp,shape coefficient for total length for subtidal population
amp,shape coefficient for total lenth
amp,shape coefficient for total weight
amp,shape coefficient for trunk length
amp,shape coefficient for trunk length_dewilde
amp,shape coefficient for veliger
amp,shape coefficient for wet flesh
amp,shape coefficient for wing length
amp,shape coefficient for yolk
amp,shape coefficient guessed
amp,shape coefficient in GreaGutj2011; measurement: tip of uropod to tip of antennal scale
amp,shape coefficient juvenile/adulte
amp,shape coefficient larva
amp,shape coefficient larvae
amp,shape coefficient nose-tibia length
amp,shape coefficient of body length
amp,shape coefficient of early juvenile
amp,shape coefficient of head length
amp,shape coefficient of imago
amp,shape coefficient of larva
amp,shape coefficient of larval stage
amp,shape coefficient of neonate
amp,shape coefficient of nymph
amp,shape coefficient pluteus
amp,shape coefficient post metam
amp,shape coefficient pre-metamorphosis
amp,shape coefficient SCL
amp,shape coefficient shell diamaeter
amp,shape coefficient shell in wet weight
amp,shape coefficient standard length
amp,shape coefficient SVL
amp,shape coefficient total length
amp,shape coefficient total length of tadpole
amp,shape coeffient
amp,shape coef (forked length)
amp,shape coeff to convert L^3 = del_M*L_d^2*L_w
amp,shape coeff to convert L_d = del_s*L_s
amp,shape coerrection coefficient
amp,shape coerrection factor
amp,shape parameter for ability to maintain target temp
amp,shape parameter for digestion efficiency
amp,shell ength at first time
amp,shell height at first data point for grp 1
amp,shell height at first data point for grp 2
amp,shell length for ingestion
amp,shrinking stress coefficient
amp,shrinking threshold
amp,silt half saturation constant
amp,slow/fast parameter for foetal development
amp,slow/fast parameter of foetal development
amp,s_M
amp,s_Megg
amp,s_MO2
amp,spec contribution of tunic to dry weight
amp,spec cost for structure
amp,spec decay rate of larval structure in pupa
amp,specific density W_shell = d_s (del_M L)^3
amp,specific shrinking rate from s to j
amp,ssc. func. resp. TehHint1998
amp,standard length at t = 0
amp,Standard length at t = 0 in JoneHyne1950 data
amp,start of development
amp,stress at instar 1: L_1^2/ L_b^2
amp,stress at instar 2: L_2^2/ L_1^2
amp,stress at instar 3: L_3^2/ L_2^2
amp,stress at instar 4: L_3^2/ L_2^2
amp,stress at instar 4: L_4^2/ L_3^2
amp,stress at instar 5: L_5^2/ L_4^2
amp,stress at instar 6: L_6^2/ L_5^2
amp,stress at instar 7 (N1): L_7^2/ L_6^2
amp,stress at instar 8 (N2): L_8^2/ L_7^2
amp,structural length at 0 in tL and tW data
amp,structural length at start of experiment
amp,structural length at time 0
amp,surf-spec somatic maint
amp,SVL at zero for tL data
amp,T_A
amp,T_AH
amp,T_AL
amp,tarra for total wet weight for conversion to larder carcass weight
amp,temp amplitude in North Sea
amp,temp amplitude in Skagerak
amp,temperature acceleration coefficient
amp,temperature amplitude for tT data
amp,temperature at lower boundary
amp,temperature at upper boundary
amp,Temperature at upper boundary
amp,temperature coefficient
amp,temperature for high end of range
amp,temperature for low end of range
amp,temp-food coupler in tL_N data
amp,temp-food coupler in tL_S data
amp,temp in culture
amp,T_H
amp,time 0 for tL_20_1 data
amp,time 0 for tL_20_2 data
amp,time 0 for tL_20_3 data
amp,time 0 for tL_80_4 data
amp,time 0 for tL_80_5 data
amp,time 0 for tL_80_6 data
amp,time are start development
amp,time at age zero for egg data
amp,time at birth
amp,time at birth for tL_0 and tWw_0 data
amp,time at birth in tL
amp,time at birth in tL and tW data
amp,time at birth in tL-data
amp,time at first eye opening
amp,time at start development
amp,time at start development at 20 C
amp,time at start development at T
amp,time at start developmentat T
amp,time at start development at T given v
amp,time at start development at T given v_e
amp,time at start development at T_ref
amp,time at start development for 1978 data
amp,time at start development for 1979 data
amp,time at start development in ab
amp,time at start development (since egg sack has been spotted)
amp,time at start develpment
amp,time at start deveopment
amp,time at start egg development
amp,time at start eggs development
amp,time at start of development
amp,time at strat development
amp,time at strat development at T
amp,time between broods at T_ref
amp,time between clutches
amp,time between clutches at T
amp,time between Naef stage 4 and 15 at T_ref
amp,time delay for T(t) in tL data
amp,time delay in T(t) data
amp,time for egg production at 20<U+FFFD>C
amp,time growth phase starts for embryo assuming a similar growth pattern to C. mydas
amp,time growth phase starts for embryo data
amp,time in tW data before after puberty
amp,time in tW data before before puberty
amp,time offset for temperature in tL data
amp,time offset for temp oscillations
amp,time offset for tT data
amp,time offset in temperature in tL data
amp,time offset in T(t) data
amp,time of start development at 20 C
amp,time since birt at zero
amp,time since birth at emergence in tW data
amp,time since birth at infection
amp,time since birth at origin
amp,time since birth at start development
amp,time since birth at start experiment
amp,time since birth at start growth experiment
amp,time since birth at start of experiment (Cian1979)
amp,time since birth at start of experiment (gaia2019)
amp,time since birth at t=0
amp,time since birth at t=0 in tA-data
amp,time since birth at t=0 of tW data
amp,time since birth at time zero
amp,time since birth at time zero (gaia2016)
amp,time since birth at time zero of tL data
amp,time since birth to start experiment
amp,time since bith at 0 in tL and tWw data
amp,time since Jan 1 at start development
amp,time since March 1 at settlement
amp,time since metam at zero
amp,time till start of development
amp,T_L
amp,total length at t=0 in tL and tW data
amp,total length at time 0
amp,total length at time zero
amp,total length at zero
amp,total length at zero for tL data
amp,total length at zero for tL_f data
amp,total length at zero for tL_m data
amp,upper boundary
amp,upper boundary 5th instar and higher
amp,upper boundary egg
amp,upper boundary temperature
amp,Upper boundary temperature
amp,upper boundary tolerance range
amp,Upper temp boundary
amp,upper temperature boundary
amp,Upper temperature boundary for optimal growth
amp,v
amp,vol. length for tL_20_1 data
amp,vol. length for tL_20_2 data
amp,vol. length for tL_20_3 data
amp,vol. length for tL_80_4 data
amp,vol. length for tL_80_5 data
amp,vol. length for tL_80_6 data
amp,vol-spec somatic maint
amp,volume at first time in tV data
amp,volume per cell of Sketetonema
amp,Weibull ageing acceleration
amp,Weibull aging acceleration
amp,Weibull aging acceleration for female
amp,Weibull aging acceleration for male
amp,Weibull aging acceleration for males
amp,weight after hybernation
amp,weight at capture
amp,weight at start experiment
amp,weight at t = 0
amp,weight at time 0
amp,weight at time zero
amp,weight at zero in tW data
amp,weigth at time 0
amp,wet weight at t = 0
amp,Wet weight at t=0 of tW data
amp,wet weight at time zero in tW data
amp,wet weight for TdW data
amp,wet weight for TJO1 data
amp,wet weight for TJO2 data
amp,wet weight for TJO data
amp,wet weight zt zero in tW and tW1 data
amp,wieght at zero in tW data
amp,yield of DNA on structure (g/g)
amp,yield of N on biomass (g/g)
amp,yield of RNA on biomass (g/g)
amp,yield of silk on larval structure
amp,yolk dry to wet mass ratio
amp,yolk shape coefficient
amp,zoom factor
amp,zoom factor before start acceleration
amp,zoom factor for cave morph
amp,zoom factor for female for male
amp,zoom factor for gray males
amp,zoom factor for male
amp,zoom factor; for male
amp,zoom factor  for males
amp,zoom factor for males
amp,zoom factor for males after puberty
amp,zoom factor for males before puberty
amp,zoom factor for male toad
amp,zoom factor for P.a.a.
amp,zoom factor for polyps
amp,zoom factor for race B
amp,zoom factor for race CS
amp,zoom factor for race CT
amp,zoom factor for race G
amp,zoom factor for race I
amp,zoom factor for race L
amp,zoom factor for race M
amp,zoom factor for race N
amp,zoom factor for race P
amp,zoom factor for race S
amp,zoom factor for race SB
amp,zoom factor for tadpole
amp,zoom factor for yellow males
amp,zoom factor fro Amur subspecies
amp,zoom factor (male)
amp,zoom factor male
amp,zoom factor males
amp,zoom factor of NA population!
amp,zoom  for males
https://opentraits.org/datasets/amphi-bio,Age_at_maturity_max_y
https://opentraits.org/datasets/amphi-bio,Age_at_maturity_min_y
https://opentraits.org/datasets/amphi-bio,Aqu
https://opentraits.org/datasets/amphi-bio,Arb
https://opentraits.org/datasets/amphi-bio,Arthro
https://opentraits.org/datasets/amphi-bio,Body_mass_g
https://opentraits.org/datasets/amphi-bio,Body_size_mm
https://opentraits.org/datasets/amphi-bio,Crepu
https://opentraits.org/datasets/amphi-bio,Dir
https://opentraits.org/datasets/amphi-bio,Diu
https://opentraits.org/datasets/amphi-bio,Dry_cold
https://opentraits.org/datasets/amphi-bio,Dry_warm
https://opentraits.org/datasets/amphi-bio,Flowers
https://opentraits.org/datasets/amphi-bio,Fos
https://opentraits.org/datasets/amphi-bio,Fruits
https://opentraits.org/datasets/amphi-bio,Lar
https://opentraits.org/datasets/amphi-bio,Leaves
https://opentraits.org/datasets/amphi-bio,Litter_size_max_n
https://opentraits.org/datasets/amphi-bio,Litter_size_min_n
https://opentraits.org/datasets/amphi-bio,Longevity_max_y
https://opentraits.org/datasets/amphi-bio,Noc
https://opentraits.org/datasets/amphi-bio,Offspring_size_max_mm
https://opentraits.org/datasets/amphi-bio,Offspring_size_min_mm
https://opentraits.org/datasets/amphi-bio,Reproductive_output_y
https://opentraits.org/datasets/amphi-bio,Seeds
https://opentraits.org/datasets/amphi-bio,Size_at_maturity_max_mm
https://opentraits.org/datasets/amphi-bio,Size_at_maturity_min_mm
https://opentraits.org/datasets/amphi-bio,Ter
https://opentraits.org/datasets/amphi-bio,Vert
https://opentraits.org/datasets/amphi-bio,Viv
https://opentraits.org/datasets/amphi-bio,Wet_cold
https://opentraits.org/datasets/amphi-bio,Wet_warm
https://opentraits.org/datasets/arthropod-species-traits,Body_Size
https://opentraits.org/datasets/arthropod-species-traits,Dispersal_ability
https://opentraits.org/datasets/arthropod-species-traits,Endophagous_lifestyle
https://opentraits.org/datasets/arthropod-species-traits,Feeding_guild
https://opentraits.org/datasets/arthropod-species-traits,Feeding_guild_short
https://opentraits.org/datasets/arthropod-species-traits,Feeding_mode
https://opentraits.org/datasets/arthropod-species-traits,Feeding_plant_part
https://opentraits.org/datasets/arthropod-species-traits,Feeding_specialization
https://opentraits.org/datasets/arthropod-species-traits,Feeding_tissue
https://opentraits.org/datasets/arthropod-species-traits,Stratum_use
https://opentraits.org/datasets/arthropod-species-traits,Stratum_use_short
https://opentraits.org/datasets/australian-birds,X100_Body_mass_min_8
https://opentraits.org/datasets/australian-birds,X101_Body_mass_max_8
https://opentraits.org/datasets/australian-birds,X102_Male_body_mass_average_8
https://opentraits.org/datasets/australian-birds,X103_Male_body_mass_min_8
https://opentraits.org/datasets/australian-birds,X104_Male_body_mass_max_8
https://opentraits.org/datasets/australian-birds,X105_Female_body_mass_average_8
https://opentraits.org/datasets/australian-birds,X106_Female_body_mass_min_8
https://opentraits.org/datasets/australian-birds,X107_Female_body_mass_max_8
https://opentraits.org/datasets/australian-birds,X108_Unsexed_body_mass_average_8
https://opentraits.org/datasets/australian-birds,X109_Unsexed_body_mass_min_8
https://opentraits.org/datasets/australian-birds,X110_Unsexed_body_mass_max_8
https://opentraits.org/datasets/australian-birds,X112_Brain_volume_8
https://opentraits.org/datasets/australian-birds,X113_Brain_mass_8
https://opentraits.org/datasets/australian-birds,X114_Brain_mass_residual_8
https://opentraits.org/datasets/australian-birds,X115_Feeding_habitat_Terrestrial_Arid_shrubland_9
https://opentraits.org/datasets/australian-birds,X116_Feeding_habitat_Terrestrial_Chenopod_shrubland_9
